{
  "process": {
    "id": "process_signalement_probleme",
    "name": "Signalement et résolution de problèmes par un locataire",
    "documentation": "Processus de gestion des signalements de problèmes dans un appartement par un locataire, incluant interventions spécialisées et clôture."
  },
  "pools": [
    {
      "id": "pool_gestion_immobiliere",
      "name": "Gestion Immobilière",
      "lanes": [
        {
          "id": "lane_locataire",
          "name": "Locataire"
        },
        {
          "id": "lane_plombier",
          "name": "Plombier"
        },
        {
          "id": "lane_electricien",
          "name": "Électricien"
        },
        {
          "id": "lane_gestionnaire",
          "name": "Gestionnaire"
        }
      ]
    }
  ],
  "nodes": [
    {
      "id": "start_signalement",
      "type": "startEvent",
      "name": "Détection d'un problème",
      "eventDefinition": "none",
      "sourceProcessElement": "event_1",
      "poolId": "pool_gestion_immobiliere",
      "documentation": "GAP: connexion automatique de secours — assigné automatiquement au pool 'pool_gestion_immobiliere' (aucun poolId fourni par la génération) ; cohérence métier non garantie, à vérifier."
    },
    {
      "id": "task_signalement",
      "type": "task",
      "name": "Signaler un problème",
      "poolId": "pool_gestion_immobiliere",
      "laneId": "lane_locataire",
      "sourceProcessElement": "activity_1"
    },
    {
      "id": "gateway_type_probleme",
      "type": "inclusiveGateway",
      "name": "Type de problème",
      "gatewayDirection": "diverging",
      "sourceProcessElement": "conditions",
      "poolId": "pool_gestion_immobiliere",
      "documentation": "GAP: connexion automatique de secours — assigné automatiquement au pool 'pool_gestion_immobiliere' (aucun poolId fourni par la génération) ; cohérence métier non garantie, à vérifier."
    },
    {
      "id": "task_plombier",
      "type": "task",
      "name": "Intervenir en plomberie",
      "poolId": "pool_gestion_immobiliere",
      "laneId": "lane_plombier",
      "sourceProcessElement": "activity_2"
    },
    {
      "id": "task_electricien",
      "type": "task",
      "name": "Intervenir en électricité",
      "poolId": "pool_gestion_immobiliere",
      "laneId": "lane_electricien",
      "sourceProcessElement": "activity_3"
    },
    {
      "id": "gateway_fusion_interventions",
      "type": "inclusiveGateway",
      "name": "Interventions terminées",
      "gatewayDirection": "converging",
      "sourceProcessElement": "event_2",
      "poolId": "pool_gestion_immobiliere",
      "documentation": "GAP: connexion automatique de secours — assigné automatiquement au pool 'pool_gestion_immobiliere' (aucun poolId fourni par la génération) ; cohérence métier non garantie, à vérifier."
    },
    {
      "id": "task_cloture",
      "type": "task",
      "name": "Clôturer le signalement",
      "poolId": "pool_gestion_immobiliere",
      "laneId": "lane_gestionnaire",
      "sourceProcessElement": "activity_4"
    },
    {
      "id": "end_signalement_cloture",
      "type": "endEvent",
      "name": "Clôture du signalement",
      "eventDefinition": "none",
      "sourceProcessElement": "event_3",
      "poolId": "pool_gestion_immobiliere",
      "documentation": "GAP: connexion automatique de secours — assigné automatiquement au pool 'pool_gestion_immobiliere' (aucun poolId fourni par la génération) ; cohérence métier non garantie, à vérifier."
    }
  ],
  "edges": [
    {
      "id": "flow_start_signalement",
      "source": "start_signalement",
      "target": "task_signalement",
      "type": "sequenceFlow",
      "sourceProcessElement": "relation_001"
    },
    {
      "id": "flow_signalement_gateway",
      "source": "task_signalement",
      "target": "gateway_type_probleme",
      "type": "sequenceFlow",
      "sourceProcessElement": "sequence_flows"
    },
    {
      "id": "flow_plomberie",
      "source": "gateway_type_probleme",
      "target": "task_plombier",
      "type": "sequenceFlow",
      "name": "Problème lié à la plomberie",
      "sourceProcessElement": "relation_004"
    },
    {
      "id": "flow_electricite",
      "source": "gateway_type_probleme",
      "target": "task_electricien",
      "type": "sequenceFlow",
      "name": "Problème lié à l'électricité",
      "sourceProcessElement": "relation_005"
    },
    {
      "id": "flow_plombier_fusion",
      "source": "task_plombier",
      "target": "gateway_fusion_interventions",
      "type": "sequenceFlow",
      "sourceProcessElement": "relation_006"
    },
    {
      "id": "flow_electricien_fusion",
      "source": "task_electricien",
      "target": "gateway_fusion_interventions",
      "type": "sequenceFlow",
      "sourceProcessElement": "relation_007"
    },
    {
      "id": "flow_fusion_cloture",
      "source": "gateway_fusion_interventions",
      "target": "task_cloture",
      "type": "sequenceFlow",
      "sourceProcessElement": "relation_008"
    },
    {
      "id": "flow_cloture_end",
      "source": "task_cloture",
      "target": "end_signalement_cloture",
      "type": "sequenceFlow",
      "sourceProcessElement": "relation_009"
    }
  ]
}