{
  "process": {
    "id": "process_intrusion_response",
    "name": "Processus de réponse à une intrusion",
    "documentation": "Processus de détection d'intrusion, alerte et actions correctives dans un entrepôt.",
    "isExecutable": true
  },
  "pools": [
    {
      "id": "pool_security_service",
      "name": "Service de sécurité",
      "lanes": []
    },
    {
      "id": "pool_night_team",
      "name": "Équipe de nuit",
      "lanes": []
    }
  ],
  "nodes": [
    {
      "id": "start_intrusion_detection",
      "type": "startEvent",
      "name": "Détection d'intrusion",
      "eventDefinition": "none",
      "sourceProcessElement": "event_1",
      "poolId": "pool_security_service"
    },
    {
      "id": "task_detect_intrusion",
      "type": "task",
      "name": "Détecter une intrusion",
      "poolId": "pool_security_service",
      "sourceProcessElement": "activity_1"
    },
    {
      "id": "task_trigger_alarm",
      "type": "task",
      "name": "Déclencher un signal d'alarme générale",
      "poolId": "pool_security_service",
      "sourceProcessElement": "activity_2"
    },
    {
      "id": "intermediate_throw_alarm",
      "type": "intermediateThrowEvent",
      "name": "Signal d'alarme générale",
      "eventDefinition": "signal",
      "eventDetail": "Alarme_intrusion",
      "sourceProcessElement": "event_2",
      "poolId": "pool_security_service"
    },
    {
      "id": "intermediate_catch_alarm",
      "type": "intermediateCatchEvent",
      "name": "Réception du signal d'alarme",
      "eventDefinition": "signal",
      "eventDetail": "Alarme_intrusion",
      "poolId": "pool_night_team",
      "documentation": "GAP: connexion automatique de secours — rattaché automatiquement au flux interne du pool 'pool_night_team' ; cohérence métier non garantie, à vérifier."
    },
    {
      "id": "task_evacuate_site",
      "type": "task",
      "name": "Évacuer les lieux",
      "poolId": "pool_night_team",
      "sourceProcessElement": "activity_3"
    },
    {
      "id": "task_lock_access",
      "type": "task",
      "name": "Verrouiller automatiquement les accès",
      "poolId": "pool_security_service",
      "sourceProcessElement": "activity_4"
    },
    {
      "id": "task_transmit_decision",
      "type": "task",
      "name": "Transmettre la décision de verrouillage",
      "poolId": "pool_security_service",
      "sourceProcessElement": "activity_5"
    },
    {
      "id": "end_process_completed",
      "type": "endEvent",
      "name": "Processus terminé : Intrusion gérée",
      "eventDefinition": "none",
      "poolId": "pool_night_team"
    }
  ],
  "edges": [
    {
      "id": "flow_start_detect",
      "source": "start_intrusion_detection",
      "target": "task_detect_intrusion",
      "type": "sequenceFlow"
    },
    {
      "id": "flow_detect_trigger",
      "source": "task_detect_intrusion",
      "target": "task_trigger_alarm",
      "type": "sequenceFlow"
    },
    {
      "id": "flow_trigger_throw_alarm",
      "source": "task_trigger_alarm",
      "target": "intermediate_throw_alarm",
      "type": "sequenceFlow"
    },
    {
      "id": "message_flow_alarm",
      "source": "intermediate_throw_alarm",
      "target": "intermediate_catch_alarm",
      "type": "messageFlow",
      "name": "Signal d'alarme"
    },
    {
      "id": "flow_catch_alarm_transmit",
      "source": "intermediate_catch_alarm",
      "target": "task_transmit_decision",
      "type": "messageFlow"
    },
    {
      "id": "flow_transmit_lock",
      "source": "task_transmit_decision",
      "target": "task_lock_access",
      "type": "sequenceFlow",
      "name": "Décision de verrouillage"
    },
    {
      "id": "flow_catch_evacuate",
      "source": "intermediate_catch_alarm",
      "target": "task_evacuate_site",
      "type": "sequenceFlow"
    },
    {
      "id": "flow_evacuate_end",
      "source": "task_evacuate_site",
      "target": "end_process_completed",
      "type": "sequenceFlow"
    },
    {
      "id": "flow_lock_end",
      "source": "task_lock_access",
      "target": "end_process_completed",
      "type": "messageFlow"
    }
  ]
}